{
  "decision_id": "exec-2026-03-16-0105",
  "strategy_id": "strat-2026-03-16-main",
  "generated_at_utc": "2026-03-16T01:05:00Z",
  "trigger_type": "new_strategy",
  "decisions": [
    {
      "symbol": "BTCUSDT",
      "action": "open",
      "direction": "long",
      "size_pct_of_exposure_budget": 35.0,
      "priority": 1,
      "urgency": "high",
      "valid_for_minutes": 10,
      "reason": "Current exposure is below target band and market conditions remain executable.",
      "reference_take_profit_condition": "If BTC reclaims the 1h range high and then stalls near the upper band, consider trimming 2% to 4% of exposure budget into strength.",
      "reference_stop_loss_condition": "If BTC loses the 1h pullback low on expanding volume, reduce risk and reassess the long thesis."
    },
    {
      "symbol": "ETHUSDT",
      "action": "wait",
      "priority": 2,
      "urgency": "normal",
      "valid_for_minutes": 10,
      "reason": "Spread and short-term structure make entry unattractive for now."
    }
  ]
}
